{
  "schema": "discover-frontier/v0",
  "statement": "Exact scores of witnessed binary unrooted trees for 17 fixed nucleotide alignments; eight optima certified by exhaustion or matching lower bounds.",
  "status": "Public pilot; review paused pending hub assessment and research review. Nine open empirical rows.",
  "evidence_level": [
    "author-checked"
  ],
  "claim_kind": [
    "exact"
  ],
  "scope": "unordered-unit-strict-v1; alignment SHA-256 and taxon/column selection are immutable per row; lower scores do not establish true history",
  "table": {
    "path": "discover/frontier-rows.json",
    "format": "json",
    "key": [
      "dataset",
      "alignment_sha256",
      "profile"
    ],
    "value": "score",
    "direction": "lower-is-better",
    "bound": "lower_bound",
    "object": "tree",
    "check_row": [
      "python3",
      "phylo.py",
      "verify",
      "{dataset}",
      "{tree}",
      "--claim",
      "{score}"
    ],
    "check_row_minutes": 1
  },
  "review": "discover/review.md",
  "updated_on": "2026-10-20",
  "sources": [
    "LITERATURE.md",
    "data/manifest.json",
    "results/benchmark.json",
    "https://phylipweb.github.io/phylip/doc/dnapars.html",
    "https://phylipweb.github.io/phylip/doc/dnapenny.html",
    "results/expansion-benchmark.json",
    "results/progress.json",
    "https://doi.org/10.18150/UZC2YR"
  ],
  "assumptions": [
    {
      "id": "maintainer",
      "statement": "Independent scientific review and donor admission remain outstanding; publication is not frontier acceptance.",
      "status": "open",
      "link": "discover/review.md"
    }
  ],
  "reproduce": "python3 scripts/check.py",
  "reproduce_full": "python3 scripts/check.py && python3 scripts/replay_search.py",
  "reproduce_minutes": 3,
  "prerequisites": [
    "Python 3.10+; standard library only"
  ]
}
